id,category_id,title_minihongo,title_english,title_japanese,minihongo,english,japanese,sort_order,audio_file
story-1,cat-75,山【やま】,The Mountain,山,私【わたし】は一【ひと】りで山【やま】に行【い】った。 道【みち】は長【なが】くて、石【いし】が多【おお】かった。 足【あし】が重【おも】くなった。でも止【と】めなかった。 上【うえ】に行【い】くと、風【かぜ】が強【つよ】くなった。 空【そら】はとても明【あか】るくて、太陽【たいよう】の光【ひかり】が全部【ぜんぶ】の物【もの】に入【はい】っていた。 私【わたし】は座【すわ】って、下【した】の海【うみ】を見【み】た。 家【いえ】のことを思【おも】った。母【はは】のことを思【おも】った。 前【まえ】の年【とし】に悪【わる】いことが多【おお】くあった。 でも今【いま】、山【やま】の上【うえ】で、その事【こと】は小【ちい】さくなった。 風【かぜ】が来【き】て、私【わたし】の体【からだ】に入【はい】った。 私【わたし】は目【め】を閉【し】めた。 心【こころ】の中【なか】で、何【なに】かが変【か】わった。,"I went to the mountain alone. The road was long and full of stones. My legs became heavy. But I did not stop. Going up, the wind grew strong. The sky was very bright, and the sun's light filled everything. I sat down and looked at the sea below. I thought of home. I thought of my mother. In the past year there had been many bad things. But now, on top of the mountain, those things became small. The wind came and passed through me. I closed my eyes. Inside my heart, something changed.",私は一人で山に行った。道は長く、石が多かった。足が重くなった。でも止まらなかった。上に行くと、風が強くなった。空はとても明るくて、太陽の光がすべてのものに降り注いでいた。私は座って、眼下の海を眺めた。家のことを思った。母のことを思った。去年は辛いことが多かった。でも今、山の上では、そのことが小さく感じられた。風が吹いて、私の体を通り抜けていった。私は目を閉じた。心の中で、何かが変わった。,1,s_1.mp3
story-2,cat-75,二【ふた】つの国【くに】,Two Countries,二つの国,ある国【くに】の人【ひと】は海【うみ】の近【ちか】くにいた。 もう一【ひと】つの国【くに】の人【ひと】は山【やま】の中【なか】にいた。 海【うみ】の国【くに】の人【ひと】は水【みず】を知【し】っていた。山【やま】の国【くに】の人【ひと】は土【つち】と木【き】を知【し】っていた。 ある日【にち】、一【ひと】りの男【おとこ】が山【やま】から出【で】て、海【うみ】まで行【い】った。 海【うみ】で女【おんな】が水【みず】の近【ちか】くに座【すわ】っていた。 男【おとこ】は海【うみ】を見【み】た。怖【こわ】かった。 女【おんな】は男【おとこ】の目【め】を見【み】て、笑【わら】った。 「怖【こわ】くないよ」と女【おんな】は言【い】った。「入【はい】ってみて。」 男【おとこ】は少【すこ】し入【はい】った。水【みず】はとても寒【さむ】かった。 二【ふた】りの言葉【ことば】は違【ちが】った。でも笑【わら】いは同【おな】じだった。 夜【よる】、二【ふた】りは火【ひ】の近【ちか】くに座【すわ】って、食【た】べ物【もの】を食【た】べた。 月【つき】が空【そら】に出【で】ていた。二【ふた】つの国【くに】から見【み】ても、一【ひと】つの月【つき】だ。,"The people of one country lived near the sea. The people of another country lived inside the mountains. The sea people knew water. The mountain people knew soil and trees. One day, a man left the mountains and walked to the sea. At the shore, a woman was sitting near the water. The man looked at the sea. He was afraid. The woman saw his eyes and laughed. ""It's not frightening,"" she said. ""Try going in."" He went in a little. The water was so cold. The two had different words. But their laughter was no different. That night they sat near a fire and ate together. The moon was out in the sky - one moon, seen from two countries.",ある国の人々は海の近くに暮らしていた。もう一つの国の人々は山の中に暮らしていた。海の国の人々は水をよく知っていた。山の国の人々は土と木をよく知っていた。ある日、一人の男が山を出て、海まで歩いていった。海辺では一人の女が水のそばに座っていた。男は海を見た。怖かった。女は男の目を見て、笑った。「怖くないですよ」と女は言った。「入ってみてください。」男は少し入った。水はとても冷たかった。二人の言葉は違っていた。でも笑いは同じだった。夜、二人は火のそばに座って、一緒に食事をした。月が空に出ていた。二つの国から見ても、月は一つだった。,2,s_2.mp3
story-3,cat-75,大【おお】きい木【き】,The Old Tree,大きな木,山【やま】の中【なか】に一【ひと】つの大【おお】きい木【き】があった。 その木【き】はとても長【なが】い時【とき】を生【い】きていた。 木【き】は多【おお】くの雨【あめ】を知【し】っていた。多【おお】くの風【かぜ】を感【かん】じていた。 子供【こども】たちが来【き】て、木【き】の上【うえ】で楽【たの】しんだ。その子供【こども】たちは大【おお】きくなって、出【で】て行【い】った。 戦【たたか】いがあった。人【ひと】たちは木【き】の近【ちか】くで泣【な】いた。 木【き】は動【うご】かなかった。ただ立【た】っていた。 動物【どうぶつ】たちが木【き】の中【なか】に入【はい】って、寝【ね】た。 草【くさ】が毎【まい】年【とし】木【き】の近【ちか】くに出【で】てきた。そして終【お】わった。 でも木【き】はまだある。 ある日【にち】の夜【よる】、一【ひと】りの女【おんな】が来【き】た。 女【おんな】は木【き】に手【て】を持【も】って、何【なに】も言【い】わなかった。 木【き】も何【なに】も言【い】わなかった。でも二【ふた】つの心【こころ】は一【ひと】つになった。,In the mountains there was one great tree. It had been alive for a very long time. The tree knew many rains. It had felt many winds. Children came and played up in its branches. Those children grew large and went away. There was fighting. People cried near the tree. The tree did not move. It only stood. Animals entered the tree and slept. Flowers came up near the tree every year. And then ended. But the tree is still here. One evening a woman came. She placed her hand against the tree and said nothing. The tree also said nothing. But their two hearts became one.,山の中に一本の大きな木があった。その木はとても長い時を生きてきた。木は多くの雨を知っていた。多くの風を感じてきた。子供たちがやって来て、木の上で遊んだ。その子供たちは大きくなって、去っていった。戦いがあった。人々は木のそばで泣いた。木は動かなかった。ただ立っていた。動物たちが木の中に入って、眠った。花が毎年木のそばに咲いた。そして散った。でも木はまだここにある。ある夜、一人の女がやって来た。女は木に手を当てて、何も言わなかった。木も何も言わなかった。でも二つの心は一つになった。,3,s_3.mp3
story-4,cat-75,子供【こども】の「なぜ」,A Child's Question,子供の「なぜ」,子供【こども】はいつも「なぜ？」と聞【き】いた。 「なぜ空【そら】は青【あお】いの？」と父【ちち】に聞【き】いた。 父【ちち】は「光【ひかり】だよ」と言【い】った。 「なぜ光【ひかり】は青【あお】くなるの？」と子供【こども】は言【い】った。 父【ちち】は考【かんが】えた。「空気【くうき】だよ」と言【い】った。 「なぜ空気【くうき】はそこにあるの？」 父【ちち】は口【くち】を閉【し】めた。 「なぜ私【わたし】は生【い】きているの？」と子供【こども】は言【い】った。 父【ちち】は子供【こども】を見【み】た。 夜【よる】になって、二【ふた】りは外【そと】に出【で】た。 空【そら】に多【おお】くの光【ひかり】があった。 子供【こども】は「きれい」と言【い】った。今【いま】は「なぜ」を言【い】わなかった。 父【ちち】はその事【こと】を感【かん】じて、笑【わら】った。,"The child always asked ""why?"" ""Why is the sky blue?"" she asked her father. ""It's the light,"" he said. ""Why does the light become blue?"" the child said. The father thought. ""It's the air,"" he said. ""Why is the air there?"" The father closed his mouth. ""Why am I alive?"" the child said. The father looked at the child. When night came, the two went outside. There were many lights in the sky. The child said ""beautiful."" This time she did not say ""why."" The father felt that, and smiled.",子供はいつも「なぜ？」と聞いた。「なぜ空は青いの？」と父に聞いた。父は「光だよ」と言った。「なぜ光は青くなるの？」と子供は言った。父は考えた。「空気だよ」と言った。「なぜ空気はそこにあるの？」父は口を閉じた。「なぜ私は生きているの？」と子供は言った。父は子供を見つめた。夜になって、二人は外に出た。空にたくさんの光があった。子供は「きれい」と言った。今度は「なぜ」とは言わなかった。父はそれを感じて、微笑んだ。,4,s_4.mp3
story-5,cat-75,犬【いぬ】と鳥【とり】,The Dog and the Bird,犬と鳥,私【わたし】の犬【いぬ】は毎【まい】日【にち】外【そと】を歩【ある】く。 今【いま】日【にち】も道【みち】を歩【ある】いていた。 空【そら】に白【しろ】い雲【くも】があった。 その雲【くも】の下【した】で、鳥【とり】が飛【と】んでいた。 犬【いぬ】は上【うえ】を見【み】て、動【うご】かなくなった。 犬【いぬ】は飛【と】びたいと思【おも】った。でも足【あし】は土【つち】の上【うえ】にある。 その時【とき】、小【ちい】さい鳥【とり】が一【いち】つ、木【き】の下【した】に来【き】た。 小【ちい】さい鳥【とり】は歩【ある】いていた。飛【と】ばなかった。 犬【いぬ】と鳥【とり】は同【おな】じ道【みち】を歩【ある】いた。 犬【いぬ】は分【わ】かった。空【そら】を飛【と】ばなくても、同【おな】じ所【ところ】に行【い】ける。 二【ふた】つの動物【どうぶつ】は、同【おな】じ風【かぜ】を感【かん】じていた。,"My dog walks outside every day. Today too, she was walking along the road. There were white clouds in the sky. Under those clouds, birds were flying. The dog looked up and stopped moving. The dog wanted to fly. But her legs are on the ground. Just then, one small bird came down under a tree. The small bird was walking. It was not flying. The dog and the bird walked the same road. The dog understood. Even without flying through the sky, you can go to the same place. The two animals were feeling the same wind.",私の犬は毎日外を歩く。今日も道を歩いていた。空に白い雲があった。その雲の下で、鳥が飛んでいた。犬は上を見て、動かなくなった。犬は飛びたいと思った。でも足は地面の上にある。その時、小さい鳥が一羽、木の下に降りてきた。小さい鳥は歩いていた。飛ばなかった。犬と鳥は同じ道を歩いた。犬は分かった。空を飛ばなくても、同じ場所に行ける。二匹の動物は、同じ風を感じていた。,5,
story-6,cat-75,遠【とお】い所【ところ】の魚【さかな】,Fish from a Far Place,遠い所の魚,私【わたし】は腹【はら】に食【た】べ物【もの】がなかった。 外【そと】に出【で】て、食【た】べ物【もの】を買【か】いに行【い】った。 「すみません。魚【さかな】はありますか。」と聞【き】いた。 男【おとこ】の人【ひと】は言【い】った。「はい、あります。この魚【さかな】は遠【とお】い海【うみ】から来【き】ました。とても良【よ】い魚【さかな】です。」 「肉【にく】もありますか。」 「はい。肉【にく】と卵【たまご】もあります。」 私【わたし】は魚【さかな】と卵【たまご】を選【えら】んだ。 「全部【ぜんぶ】でいくらですか。」 「三【さん】百【びゃく】です。」 少【すこ】し高【たか】いと思【おも】った。でも遠【とお】い所【ところ】の魚【さかな】だから。 お金【かね】を与【あた】えて、家【いえ】に来【き】た。 魚【さかな】と卵【たまご】で食【た】べ物【もの】を作【つく】った。 腹【はら】に食【た】べ物【もの】が入【はい】って、体【からだ】が温【あたた】かくなった。 たぶん後【あと】の日【にち】も、あの魚【さかな】を買【か】いに行【い】く。,"I had no food in my belly. I went outside to buy food. ""Excuse me. Do you have fish?"" I asked. The man said, ""Yes, we do. This fish came from a far sea. It is very good fish."" ""Do you have meat too?"" ""Yes. We have meat and eggs too."" I chose fish and eggs. ""How much is it all?"" ""Three hundred."" I thought it was a little expensive. But the fish is from a far place. I gave the money and went home. I made food with the fish and eggs. Food entered my belly, and my body became warm. Maybe tomorrow I will go buy that fish again.",私はお腹に食べ物がなかった。外に出て、食べ物を買いに行った。「すみません。魚はありますか。」と聞いた。男の人は言った。「はい、あります。この魚は遠い海から来ました。とても良い魚です。」「肉もありますか。」「はい。肉と卵もあります。」私は魚と卵を選んだ。「全部でいくらですか。」「三百円です。」少し高いと思った。でも遠い所の魚だから。お金を渡して、家に帰った。魚と卵で料理を作った。お腹に食べ物が入って、体が温かくなった。たぶん明日も、あの魚を買いに行く。,6,
story-7,cat-75,髪【かみ】を切【き】る人【ひと】,The Barber,髪を切る人,髪【かみ】が長【なが】くなった。切【き】る時【とき】が来【き】た。 私【わたし】は歩【ある】いて、髪【かみ】を切【き】る所【ところ】に行【い】った。 中【なか】に入【はい】ると、男【おとこ】の人【ひと】が言【い】った。「どうしますか。」 「髪【かみ】を切【き】ってください。少【すこ】しだけ。」 男【おとこ】の人【ひと】は私【わたし】の髪【かみ】を手【て】で持【も】って、見【み】た。 「髪【かみ】がとても強【つよ】いですね。」と男【おとこ】の人【ひと】は話【はな】した。 「本当【ほんとう】ですか。」 「はい。たぶん骨【ほね】も強【つよ】いです。」 私【わたし】は笑【わら】った。「分【わ】かりません。でも歯【は】は強【つよ】いです。」 男【おとこ】の人【ひと】も笑【わら】った。 「頭【あたま】の皮【かわ】は良【よ】いですか。」 「いいえ、少【すこ】し赤【あか】いです。太陽【たいよう】の光【ひかり】が強【つよ】かったから。」 男【おとこ】の人【ひと】はとても良【よ】く切【き】った。 終【お】わった後【あと】、私【わたし】の髪【かみ】は新【あたら】しくなった。 髪【かみ】を切【き】る人【ひと】と話【はな】すのは楽【たの】しかった。,"My hair had gotten long. The time to cut it had come. I walked to the place where they cut hair. When I went in, a man said, ""What would you like?"" ""Please cut my hair. Just a little."" The man held my hair in his hand and looked. ""Your hair is very strong,"" the man said. ""Really?"" ""Yes. Maybe your bones are strong too."" I laughed. ""I don't know. But my teeth are strong."" The man laughed too. ""Is the skin on your head okay?"" ""No, it is a little red. The sunlight was strong."" The man cut very well. After it was done, my hair felt new. Talking with the barber was fun.",髪が長くなった。切る時が来た。私は歩いて、髪を切る所に行った。中に入ると、男の人が言った。「どうしますか。」「髪を切ってください。少しだけ。」男の人は私の髪を手で持って、見た。「髪がとても強いですね。」と男の人は話した。「本当ですか。」「はい。たぶん骨も強いでしょう。」私は笑った。「分かりません。でも歯は強いです。」男の人も笑った。「頭の肌は大丈夫ですか。」「いいえ、少し赤いです。日差しが強かったので。」男の人はとても上手に切った。終わった後、髪が新しくなった。髪を切る人と話すのは楽しかった。,7,
